id;org_nom;org_adresse;code_postal;commune;url;niveau_enfant;titre;activite;public;type_ressource;thematiques;handicap_adapt;duree_txt;perennite;rattachement;thematique_autre;autre_precise;geo;lat;lon;code_postal_num;duree_min;description;long_duration;is_for_kids;is_accessible;date
725;Chaillot - Théâtre national de la Danse;1 Place du Trocadéro et du 11 Novembre;75016;Paris;http://theatre-chaillot.fr/fr/chaillotchezvous;;Chaillot chez vous;Concerts, spectacles;Tous publics;VIDÉO|FLUX EN DIRECT|PROGRAMMES EN DIFFÉRÉ;DANSE;;Le temps d’un week-end;Accès gratuit exceptionnel et limité dans le temps;Ministère de la Culture ou opérateur national;;;48.862905,2.288342;48.862905;2.288342;75016;2880;Une collection de vidéo en libre accès. Vivez de grandes émotions à travers les créations des plus grands chorégraphes programmés à Chaillot – Théâtre national de la Danse. Des captations de spectacles et autres vidéos de rencontres, activités, portraits d’artistes sont mises à votre disposition.;true;false;false;2022-03-16
784;Ecole supérieure d'arts & médias;17 Cours Caffarelli;14000;Caen;https://www.esam-c2.fr/a-la-maison;;A la maison;Approfondir ses connaissances;Tous publics;RESSOURCES PÉDAGOGIQUES;ARTS DÉCORATIFS|DESIGN|MÉTIERS D’ART|ARTS VISUELS;;Le temps d’une soirée;Accès gratuit exceptionnel et limité dans le temps;Collectivité territoriale;;;49.180415,-0.346498;49.180415;-0.346498;14000;120;"À partir du 23 mars, les enseignants du secteur Grand public de l’école supérieure d'arts &amp; médias de Caen/Cherbourg proposent tous les lundis matin à leurs élèves mais aussi à un plus large public des idées de sujets et d’exercices afin de continuer (ou de débuter) la pratique des arts plastiques à la maison, seul·e ou en famille.";false;false;false;2024-08-03
850;Hippocampe - Association pour la recherche en Mime Corporel;2 Passage de la Fonderie;75011;Paris;https://www.mime-corporel-theatre.com/mimesis/310-gestez-chez-vous-une-creation-participative.html;;Gestez Chez Vous ! Une création participative;Partager ses passions;Tous publics;CRÉATION ET PRATIQUES ARTISTIQUES;THÉÂTRE|SPECTACLES;;Le temps d’un week-end;Accès gratuit exceptionnel et limité dans le temps;Organisme privé;;;48.866879,2.375511;48.866879;2.375511;75011;2880;Une création participative de la Compagnie Hippocampe et du Théâtre Victor Hugo - Bagneux. Nous vous invitons à créer une courte pièce de mouvement basé sur les principes du Mime et des Arts du Geste. Trois tutoriels sont à votre disposition pour vous guider. Par la suite les vidéos de ses pièces seront publiés sur le web.;true;false;false;2022-07-13
893;Labex Les passés dans le présent - Université Paris Nanterre;200 avenue de la République;92000;Nanterre;http://www.lacontemporaine.fr/expositions/ldh/;;Expositions virtuelles;Expos, musées;Tous publics;IMAGES|COLLECTIONS NUMÉRISÉES|BASES DE DONNÉES;HISTOIRE|LITTÉRATURE|SCIENCES HUMAINES|LANGUES;;Le temps d’un vrai déjeuner;Accès permanent;Ministère de la Culture ou opérateur national;;;48.903003,2.209615;48.903003;2.209615;92000;60;Caricature et violence de l'Histoire, Ligue des droits de l’Homme - 120 ans d'histoires, les années 68 - un monde en mouvement, Le Goulag à la veille de sa disparition;false;false;false;2024-03-22
1001;Musée de la gendarmerie nationale;18 Boulevard Henri IV;75004;Paris;https://www.google.com/maps/@48.5453775,2.6526826,3a,75y,48.66h,98.13t/data=!3m7!1e1!3m5!1sAF1QipPB7OiTH3lD3NS5PgSKks7In30IUsbkHqspTsPC!2e10!3e12!7i11898!8i5949;;Visite virtuelle;Expos, musées;Tous publics;EXPOSITIONS VIRTUELLES;MUSÉES;;Le temps de manger un sandwich pendant une pause déjeuner;Accès permanent;Organisme labellisé, conventionné ou subventionné par le ministère de la culture;;;48.851382,2.363853;48.851382;2.363853;75004;10;Découvrez les espaces permanents du Musée de la gendarmerie nationale à travers une visite à 360°. L'occasion exclusive de plonger au coeur d'un musée qui vous est dédié.;false;false;false;2023-09-18
1111;Orchestre de l'Alliance;26 rue de l'Exposition;75007;Paris;https://orchestredelalliance.fr/orchestre/culturecheznous/;;Exploration musicale avec l'Orchestre de l'Alliance;Concerts, spectacles;Tous publics;VIDÉO|FLUX EN DIRECT|PROGRAMMES EN DIFFÉRÉ;MUSIQUE|CONCERTS ET OPÉRAS;;Le temps d’une soirée;Accès permanent;Organisme privé;;;48.857216,2.30318;48.857216;2.30318;75007;120;L’Orchestre de l’Alliance vous propose d’explorer l’univers musical d’un compositeur à travers une vidéo explicative du chef d’orchestre Pejman Memarzadeh, ainsi que de plusieurs captations de concerts de l’Orchestre. Consacrée chaque fois à un compositeur différent, il dévoilera son approche artistique, ses coups de cœur, ses réflexions liées à son travail d’interprétation, ses sources d’influences et donnera quelques clefs d'écoute pour découvrir, de l'intérieur, les œuvres et leurs secrets.;false;false;false;2024-01-27
1142;Radio France;116, avenue du président-Kennedy;75016;Paris;https://www.francemusique.fr/concerts;;Concerts de France Musique;Audios;Tous publics;AUDIO|RADIO|PODCASTS;AUDIOVISUEL|MUSIQUE|CONCERTS ET OPÉRAS;;Le temps d’une soirée;Accès permanent;Ministère de la Culture ou opérateur national;;;48.852149,2.279529;48.852149;2.279529;75016;120;Tous les concerts en replay. Une sélection de concerts à voir en replay et à écouter en streaming audio haute définition. Musique classique, symphoniques, de chambre, jazz... joués à la Maison de la radio et dans les plus grandes salles, avec l'Orchestre philharmonique de Radio France, l'Orchestre National de France et de nombreux orchestres et solistes internationaux, les concerts sont en réécoute en ligne gratuitement et en intégralité sur France Musique.;false;false;false;2023-05-24
657;Association Zebrock;2 rue Saint-Just;93130;Noisy-le-Sec;https://www.melo-app.com/;;Mélo, le média participatif autour de la musique et du monde;Actualités, débats;Tous publics;CRÉATION ET PRATIQUES ARTISTIQUES;MUSIQUE|CONCERTS ET OPÉRAS;;Le temps de manger un sandwich pendant une pause déjeuner;Accès permanent;Organisme labellisé, conventionné ou subventionné par le ministère de la culture;;;48.894902,2.452203;48.894902;2.452203;93130;10;Entièrement gratuit, Mélo est un explorateur interactif de contenus musicaux interconnectés développé par l’association Zebrock. Mélo combine plusieurs fonctionnalités : une carte du monde interactive, une bibliothèque médias, un catalogue de notices et de parcours thématiques, un éditeur intégré pour créer ses propres contenus.;false;false;false;2024-09-04
674;Bibliothèque nationale de France (BNF);Quai François Mauriac;75706;Paris;http://expositions.bnf.fr;;Expositions virtuelles;Expos, musées;Tous publics;EXPOSITIONS VIRTUELLES;BANDE DESSINÉE|HISTOIRE|LITTÉRATURE|SCIENCES HUMAINES|LANGUES;;Toute une vie ne suffit pas;Accès permanent;Ministère de la Culture ou opérateur national;;;48.833194,2.378216;48.833194;2.378216;75706;150;"Ce site donne accès à 98 expositions virtuelles classées en 6 galeries (Le livre et l’écrit, Ecrivains et conteurs, Histoire des représentations, Arts et architecture, Photographie, Cartes, plans et globes). Une occasion de retrouver les déclinaisons web des grandes expositions de la BnF comme ""Les Nadar, une légende photographique"".";true;false;false;2025-06-18
752;COLORS Urban Art;8 quai zorn;67000;Strasbourg;https://strasbourg.streetartmap.eu/;;Street Art Map;Expos, musées;Tous publics;EXPOSITIONS VIRTUELLES;ART URBAIN (GRAPH|HIP HOP|STREET ART…);;Le temps d’une soirée;Accès permanent;Organisme privé;;;48.588605,7.759491;48.588605;7.759491;67000;120;Carte interactive et participative qui vous permet de découvrir les meilleurs spots de street art et de graffiti sur l'Eurométropole de Strasbourg. StreetArtMap.eu référence les différents spots où vous pourrez trouver des œuvres dans la rue : Collage, Sticker, Fresque, Tag, Pochoir, Légal et même Vandal… Plus qu’une simple carte, cette « Outdoor Museum » dispose aussi d’un blog pour vous tenir informé de l’actualité street art et graffiti en Alsace.;false;false;false;2023-07-10
805;Feedbooks;15 lisière du golf;92380;Garches;http://fr.feedbooks.com/publicdomain;;Librairie 100% numérique gratuite;Livres;Tous publics;LIVRES NUMÉRIQUES;LITTÉRATURE|SCIENCES HUMAINES|LANGUES;;Toute une vie ne suffit pas;Accès permanent;Organisme privé;;;48.854619,2.192625;48.854619;2.192625;92380;150;Des centaines d'ouvrages du domaine public à télécharger gratuitement, comme Robinson Crusoé de Daniel Defoe ou encore De la terre à la lune de Jules Vernes.;true;false;false;2024-06-06
814;Festival Little CIRCULATION(S);121 rue de Charonne;75011;Paris;https://www.festival-circulations.com/evenement/little-circulations-2020/;;Little CIRCULATION(S) à la maison;Approfondir ses connaissances;Parents / Éducateurs;RESSOURCES PÉDAGOGIQUES;ARTS DÉCORATIFS|DESIGN|MÉTIERS D’ART;;Le temps d’un vrai déjeuner;Accès gratuit exceptionnel et limité dans le temps;Organisme labellisé, conventionné ou subventionné par le ministère de la culture;;;48.854857,2.385749;48.854857;2.385749;75011;60;En ces temps de confinement, Little CIRCULATION(S), l’exposition à hauteur d’enfants, vient te rendre visite à la maison. Nous te proposons de découvrir des artistes du festival avec une approche ludique dédiée au jeune public – mêlant observation et amusement !;false;false;false;2023-03-22
864;Institut national de l'audiovisuel (INA);18, avenue des Frères-Lumière;94366;Bry-sur-Marne;https://www.youtube.com/user/inachansons;;INA Chansons;Films, documentaires, vidéos;Tous publics;VIDÉO|FLUX EN DIRECT|PROGRAMMES EN DIFFÉRÉ|EXPOSITIONS VIRTUELLES;AUDIOVISUEL|HISTOIRE|LITTÉRATURE|SCIENCES HUMAINES|LANGUES;;Toute une vie ne suffit pas;Accès permanent;Ministère de la Culture ou opérateur national;;;48.836527,2.532676;48.836527;2.532676;94366;150;Plus de 3000 vidéos inédites d'artistes français et internationaux.Retrouvez Barbara, Brel, Souchon, Johnny Hallyday, Claude François, Sacha Distel, Pink Floyd, Rolling Stone, Mike Brant, Sardou, Gainsbourg, Nicole Croisille, France Gall, Eddy Mitchell, Michel Delpech, Joe Dassin,  Fugain, Dutronc, Jonasz, Sylvie Vartan, Marcel Amont, Nougaro ..;true;false;false;2024-07-29
1055;Musée national de l'histoire de l'immigration (EPPD);293 Avenue Daumesnil;75012;Paris;https://www.histoire-immigration.fr/ressources;;Ressources en ligne;Expos, musées;Tous publics;IMAGES|COLLECTIONS NUMÉRISÉES|BASES DE DONNÉES;HISTOIRE|LITTÉRATURE|SCIENCES HUMAINES|LANGUES|MUSÉES;;Le temps d’une soirée;Accès permanent;Ministère de la Culture ou opérateur national;;;48.834638,2.409586;48.834638;2.409586;75012;120;Collections en ligne, vidéos, dossier thématiques : profitez de l'offre numérique du Musée national de l'histoire de l'immigration, qui est chargé de constituer une collection représentative de l’histoire, des arts et des cultures de l’immigration.;false;false;false;2024-12-13
1080;Muséum d'histoire naturelle;57 Rue Cuvier;75005;Paris;https://www.mnhn.fr/fr/explorez/applications-mobiles-realite-virtuelle;;Les applications et jeux;Jeux;Tous publics;JEUX;PARCS ET JARDINS|MUSÉES|SCIENCES;;Le temps d’une soirée;Accès permanent;Organisme labellisé, conventionné ou subventionné par le ministère de la culture;;;48.844345,2.356233;48.844345;2.356233;75005;120;8 jeux mobiles et applications de réalité virtuelle autour de la nature, développés par le musée et ses partenaires.;false;false;false;2023-05-22
1292;La Scène Watteau;1 place du théâtre;94130;Nogent-sur-Marne;https://www.scenewatteau.fr/project/podcasts-de-salut-public/;;Les podcasts de salut public;Audios;Tous publics;AUDIO|RADIO|PODCASTS;LITTÉRATURE|SCIENCES HUMAINES|LANGUES;;Le temps de manger un sandwich pendant une pause déjeuner;Accès permanent;Organisme labellisé, conventionné ou subventionné par le ministère de la culture;;;48.839155,2.493482;48.839155;2.493482;94130;10;Durant cette longue période de confinement qui bouscule nos pratiques culturelles, La Scène Watteau se félicite de participer à l’opération #culturecheznous impulsée par le ministère de le Culture. Dans le cadre de cette initiative, nous vous proposons d’écouter chez vous 6 premiers podcasts inspirés des lectures de salut public programmées chaque saison à La Scène Watteau. D’autres podcasts sont en cours de réalisation, ils vous seront dévoilés très prochainement. Bonne écoute !;false;false;false;2023-05-20
1301;Pôle d'archéologie Orléans;13bis rue de la Tour Neuve;45000;Orleans;http://archeologie.orleans-metropole.fr/;;Musée virtuel;Approfondir ses connaissances;Tous publics;EXPOSITIONS VIRTUELLES;ARCHÉOLOGIE|ARCHITECTURE ET PATRIMOINE;TRANSCRIPTION TEXTUELLE|JEU UTILISANT DU HTML|NAVIGATION AU CLAVIER|FACILE À LIRE ET À COMPRENDRE (FALC);Le temps d’une soirée;Accès permanent;Collectivité territoriale;;;47.899413,1.913575;47.899413;1.913575;45000;120;Carte interactive, voyage archéologique dans les souterrains de la ville, Archéologie des animaus : le site du Pôle d'archéologie présente les découvertes effectuées sur tout le territoire orleanais. Elles sont agrémentées de dossiers thématiques et d'activités ludiques pour petits et grands. A decouvrir aussi le musée virtuel avec les objts archéologiques qui racontent l'histoire d'Orléans.;false;false;true;2022-12-10
1308;Beaux Arts Magazine (Beaux Arts & Cie);9 boulevard de la Madeleine;75001;Paris;https://www.beauxarts.com/evenement/culture-chez-nous/;;Magazine numérique gratuit;Approfondir ses connaissances;Tous publics;IMAGES|COLLECTIONS NUMÉRISÉES|BASES DE DONNÉES;ARCHITECTURE ET PATRIMOINE|ART URBAIN (GRAPH|HIP HOP|STREET ART…)|ARTS DÉCORATIFS|DESIGN|MÉTIERS D’ART|ARTS VISUELS|BANDE DESSINÉE|PEINTURE|PHOTOGRAPHIE|SCULPTURE;;Toute une vie ne suffit pas;Accès permanent;Organisme privé;;;48.869529,2.326744;48.869529;2.326744;75001;150;BeauxArts.com permet à tous les amateurs d'art de se cultiver avec des contenus en ligne documentés, riches et illustrés liés à l'art et aux artistes : articles, vidéos, le dernier numéro de Beaux Arts Magazine... Il fournit aux professeurs et aux élèves des supports pédagogiques fiables, rédigés par des spécialistes des arts plastiques, didactiques et richement illustrés : parmi eux, notamment, l'encyclopédie des artistes et des mouvements artistiques.;true;false;false;2025-08-17
1341;TV5 Monde;131 avenue de Wagram;75017;Paris;https://culture.tv5monde.com/arts-et-spectacles/quesaco;;Quèsaco;Films, documentaires, vidéos;Tous publics;VIDÉO|FLUX EN DIRECT|PROGRAMMES EN DIFFÉRÉ;ARTS VISUELS|PEINTURE|MUSÉES;;Le temps de manger un sandwich pendant une pause déjeuner;Accès permanent;Ministère de la Culture ou opérateur national;;;48.883586,2.301932;48.883586;2.301932;75017;10;Sur un ton décalé, drôle et résolument moderne, « Quèsaco » tente de répondre en 2’ à la question que l’on se pose parfois devant une peinture : « Mais qu’est-ce que c’est que ce tableau ? ». En observant quelques chefs d'oeuvre exposés au musée d’Orsay à Paris « Quèsaco » propose des éléments de réponse, en s’attachant à replacer l’œuvre et son auteur dans son contexte historique, artistique ou politique puis en cherchant des indices disséminés dans la toile.;false;false;false;2023-05-03
1382;Musée du Louvre;Rue de Rivoli;75001;Paris;https://mooc-culturels.fondationorange.com/enrol/synopsis/index.php?id=26;;MOOCs Culturels;Expos, musées;Tous publics;VIDÉO|FLUX EN DIRECT|PROGRAMMES EN DIFFÉRÉ;ARCHITECTURE ET PATRIMOINE|MUSÉES|PEINTURE|SCULPTURE;;Le temps d’un vrai déjeuner;Accès permanent;Ministère de la Culture ou opérateur national;;;48.862527,2.335861;48.862527;2.335861;75001;60;De l’Antiquité à nos jours, d’innombrables chefs d’œuvres n’attendent plus que vous pour révéler leurs secrets. Alors arrêtez tout le temps d’un MOOC… et rejoignez le mouvement !;false;false;false;2023-11-29
1401;Fonds régionaux d'art contemporain;3 rue de Valois;75011;Paris;http://www.lescollectionsdesfrac.fr/;;Les collections des FRAC;Approfondir ses connaissances;Tous publics;;ARTS DÉCORATIFS|DESIGN|MÉTIERS D’ART|ARTS VISUELS|PHOTOGRAPHIE;;Le temps de manger un sandwich pendant une pause déjeuner;Accès permanent;Ministère de la Culture ou opérateur national;;;48.863666,2.337933;48.863666;2.337933;75011;10;Aujourd’hui, les collections des Frac rassemblent plus de 30 000 œuvres de 5 700 artistes autant français qu’étrangers. Depuis plus de 30 ans, les Frac assurent ainsi leur mission de soutien aux jeunes artistes en étant souvent les premières institutions à acquérir leurs œuvres.;false;false;false;2025-02-24
1417;Audiovisit;508 Avenue du 8 Mai 1945;69300;Caluire-et-Cuire;https://shows.acast.com/le-son-de-peinture/episodes;;Le son de peinture;Audios;Tous publics;AUDIO|RADIO|PODCASTS;ARTS VISUELS|MUSÉES|PEINTURE;;Le temps d’une soirée;Accès permanent;Organisme privé;;;45.79528,4.850877;45.79528;4.850877;69300;120;350 chefs-d’œuvre de la peinture en 350 épisodes de 2 minutes ! 7 siècles d’histoire de la peinture au travers de 112 artistes dont : Modigliani, Renoir, Pissarro, Caravaggio, Friedrich, Monet, Velasquez, Degas, Manet, Delacroix, Picabia, Goya, Boucher, de la Tour, Courbet, David, van Eyck, Ingres, Fragonard, Turner, de Vinci, Cranach, Poussin, Véronèse, Cézanne, Gauguin, Klee, Rubens, Bonnard, Bruegel, Raphael, Rembrandt, Botticelli, Titien, van Gogh, Kandinsky…;false;false;false;2024-10-07
1640;Réunion des Musées Métropolitains Rouen Normandie;26 bis rue Jean Lecanuet;76000;Rouen;https://my.matterport.com/show/?m=GwPv5LT2UVs;;Exposition virtuelle - François Depeaux L'homme aux 600 tableaux;Expos, musées;Tous publics;IMAGES|COLLECTIONS NUMÉRISÉES|BASES DE DONNÉES|EXPOSITIONS VIRTUELLES;ARTS VISUELS|MUSÉES|PEINTURE;;Le temps d’un vrai déjeuner;Accès permanent;Collectivité territoriale;;Navigation avec la souris;49.444119,1.095516;49.444119;1.095516;76000;60;Le Musée des Beaux-Arts de Rouen propose d’explorer la vie d’une figure centrale pour le mouvement impressionniste : le magnat du charbon François Depeaux (1853- 1920). Acheteur compulsif, cet industriel rouennais a possédé près de 600 tableaux et dessins, comptant jusqu’à 55 Sisley, 20 Monet, mais aussi des chefs-d’œuvre de Renoir, Toulouse-Lautrec, Pissarro…;false;false;false;2025-04-01
1815;Musée d'art moderne et contemporain Saint-Étienne Métropole;Fernand Léger;42270;Saint-Priest-En-Jarez;https://oeuvresoeur.fr/;;"Jeu numérique ""Trouve ton oeuvre soeur""";Jeux;Tous publics;JEUX;ARTS VISUELS|ÉDUCATION ARTISTIQUE ET CULTURELLE|MUSÉES|PEINTURE|PHOTOGRAPHIE|SCULPTURE;;Le temps de manger un sandwich pendant une pause déjeuner;Accès permanent;Organisme labellisé, conventionné ou subventionné par le ministère de la culture;;;48.501611,-2.747081;48.501611;-2.747081;42270;10;"Trouve ton œuvre sœur est un jeu destiné principalement aux adolescents (mais pas que ...). Le principe ? Un test d'une quinzaine de questions, comme dans un magazine, établit les grandes lignes de la personnalité du joueur. Pas de questions pièges : il suffit de faire son choix parmi les réponses proposées. Un algorithme ""matche"" le profil du joueur avec une œuvre de la collection. L'œuvre sœur du joueur est dévoilée A l'occasion du second confinement, le jeu est jouable à 100 % depuis chez vous.";false;false;false;2024-03-03
1874;Réseau Diagonal;2 rue Vincent Leblanc;13002;Marseille;https://reseau-diagonal.com/podcasts-un-reseau-la-croisee-des-chemins-et-des-images#podcasts-entete;;Podcast Diagonal;Audios;Tous publics;AUDIO|RADIO|PODCASTS|CRÉATION ET PRATIQUES ARTISTIQUES;ARTS VISUELS|ÉDUCATION ARTISTIQUE ET CULTURELLE|PHOTOGRAPHIE;;Le temps de manger un sandwich pendant une pause déjeuner;Accès permanent;Organisme labellisé, conventionné ou subventionné par le ministère de la culture;;;43.303102,5.369379;43.303102;5.369379;13002;10;"Ecoutez ce que les artistes, le public, les centres d'art et de photographie réunis au sein du réseau Diagonal ont a vous raconter sur l'exercice de leur métier, de leur passion, de leur démarche.&nbsp; Plongez grâce à cette série de podcasts en immersion dans ""Entre les images "", un programme national d'ateliers de transmission et de pratique photographique développé par le réseau Diagonal et ses membres avec le soutien du ministère de la Culture. Un road movie sonore produit par Diagonal et réalisé par le studio Ecran Sonore.&nbsp; En un ""clic"" la photographie deviendra sonore et ça c'est inédit !";false;false;false;2023-09-24
1951;Philharmonie de Paris;221 avenue Jean Jaurès;75019;Paris;https://pad.philharmoniedeparis.fr/genre-jeunes-familles.aspx?_ga=2.56889514.1835102594.1606723978-1658458088.1558550014&fbclid=;;Concerts et Jeux famille;Approfondir ses connaissances;Parents / Éducateurs;VIDÉO|FLUX EN DIRECT|PROGRAMMES EN DIFFÉRÉ|AUDIO|RADIO|PODCASTS|JEUX;MUSIQUE|CONCERTS ET OPÉRAS;;Le temps d’une soirée;Accès permanent;Ministère de la Culture ou opérateur national;;;48.889311,2.393824;48.889311;2.393824;75019;120;Découvrez des ressources de la Cité de la musique - Philharmonie de Paris adaptées au jeune public et aux familles et retrouvez les outils pour se préparer aux concerts familles et participatifs.;false;false;false;2022-07-22
2208;Association e-Enfance;11 rue des Halles;75001;Paris;https://quiz-digital-incollables.playbac.fr/deviens-un-super-heros-du-net/39;;Les Incollables;Approfondir ses connaissances;Tous publics;RESSOURCES PÉDAGOGIQUES|JEUX;ÉDUCATION AUX MÉDIAS;NAVIGATION AU CLAVIER;Le temps d’un vrai déjeuner;Accès permanent;Organisme labellisé, conventionné ou subventionné par le ministère de la culture;;;48.859708,2.346596;48.859708;2.346596;75001;60;Les Incollables ® « Super-héros du net » Avec son partenaire les éditions Playbac ©, l’Association e-Enfance propose une édition spéciale Les Incollables ® sur les « Super-héros du net ». Ce jeu éducatif sous forme de quiz s’adresse aux élèves de primaire. Dans sa version interactive, les jeunes internautes et leurs parents pourront découvrir : – les bonnes pratiques en ligne, notamment sur smartphone et réseaux sociaux – les bons réflexes dans les situations de harcèlement en ligne – les droits sur Internet, comme le droit d’accès ou de déréférencement, pour apprendre à devenir des citoyens numériques. Date : 2020 Public : Parents et enfants de primaire Thème : Bonnes pratiques en ligne;false;false;true;2025-06-25
2220;Espace de l'Art Concret;Château de Mouans;06370;Mouans-Sartoux;https://www.youtube.com/channel/UCahwNEGdmhd1vBBBbmQoLbA;;Chaîne Youtube;Approfondir ses connaissances;Tous publics;VIDÉO|FLUX EN DIRECT|PROGRAMMES EN DIFFÉRÉ;ARTS VISUELS;SOUS-TITRAGE;Le temps d’un vrai déjeuner;Accès permanent;Organisme labellisé, conventionné ou subventionné par le ministère de la culture;;;43.636985,6.974214;43.636985;6.974214;6370;60;Vidéos inédites autour de la restauration d'œuvres d’art, des rencontres d'artistes, ou encore des réserves de la collection.;false;false;true;2022-11-05
2317;Visite 360 Pro;211 rue du Ballon, appt 46 bat B 6eme etg;59110;La Madeleine;https://iss360.ovh/;;Visite virtuelle de Station Spatiale Internationale (ISS);Films, documentaires, vidéos;Tous publics;VIDÉO|FLUX EN DIRECT|PROGRAMMES EN DIFFÉRÉ|RESSOURCES PÉDAGOGIQUES;SCIENCES;NAVIGATION AU CLAVIER;Le temps d’un vrai déjeuner;Accès permanent;Organisme privé;Activités spatiales;Module de traduction;50.646292,3.079846;50.646292;3.079846;59110;60;Découvrez l'ISS comme si vous y étiez ! Pendant ses 196 jours passés à bord de la Station Spatiale Internationale, Thomas Pesquet a réalisé des clichés pour un Google Street View de ISS. En voici une version hyper enrichie par Visite 360 Pro.;false;false;true;2022-03-22
2370;Les Livreurs;31, rue Benjamin Franklin;75016;Paris;https://leslivreurs.com/solo-theatre/;;Solos théâtre;Concerts, spectacles;Tous publics;VIDÉO|FLUX EN DIRECT|PROGRAMMES EN DIFFÉRÉ;THÉÂTRE|SPECTACLES;;Le temps d’une soirée;Accès permanent;Organisme privé;;;48.861068,2.286192;48.861068;2.286192;75016;120;Solo théâtre : un interprète, une pièce, une heure ! Un véritable « Tout en 1 » Seul en scène et avec sa voix comme unique alliée, 1 interprète fait entendre 1 pièce de théâtre en 1 heure. Ni décor, ni accessoire – pourtant tout y est : intensité des émotions, virtuosité des caractères, élégance du verbe.;false;false;false;2025-07-28
2377;Centre des arts;12-16 rue de la libération;95880;Enghien Les Bains;https://www.youtube.com/user/Cine70s/videos;;Ciné club Jean-Baptiste Thoret;Approfondir ses connaissances;Parents / Éducateurs;COURS EN LIGNE|COURS EN LIGNE OUVERTS ET MASSIFS|CONFÉRENCES|TUTORIELS;CINÉMA|ÉDUCATION ARTISTIQUE ET CULTURELLE;;Le temps d’une soirée;Accès permanent;Organisme labellisé, conventionné ou subventionné par le ministère de la culture;;;48.972266,2.305695;48.972266;2.305695;95880;120;Critique, historien du cinéma et réalisateur, grand exégète des seventies, Jean-Baptiste Thoret a présenté 4 cycles au Centre des arts d'Enghien-les-Bains. Sa passion et son énergie communicatives vous donneront l'envie de découvrir ou redécouvrir tout un pan de l'histoire du histoire du cinéma.;false;false;false;2023-10-25
