id;org_nom;org_adresse;code_postal;commune;url;niveau_enfant;titre;activite;public;type_ressource;thematiques;handicap_adapt;duree_txt;perennite;rattachement;thematique_autre;autre_precise;geo;lat;lon;code_postal_num;duree_min;description;long_duration;is_for_kids;is_accessible;date
2469;Opéra National de Lorraine;1, rue Sainte-Catherine;54000;Nancy;https://www.opera-national-lorraine.fr/fr/nox-1;;Êtes-vous amoureux ?;Films, documentaires, vidéos;Tous publics;VIDÉO|FLUX EN DIRECT|PROGRAMMES EN DIFFÉRÉ;MUSIQUE|CONCERTS ET OPÉRAS;;Le temps d’un vrai déjeuner;Accès permanent;Ministère de la Culture ou opérateur national;;;48.693932,6.184266;48.693932;6.184266;54000;60;"L’Opéra national de Lorraine se dote avec le NOX (Nancy Opera Xperience) d’un laboratoire de création lyrique.
Pour sa première édition, l’Opéra a réuni&nbsp;des artistes internationaux, invités à exprimer leur regard sur Nancy. Êtes-vous amoureux ?, c’est la question indiscrète que nous avons posée aux Nancéiennes et Nancéiens entre l'été 2019 et l'hiver 2020. Leurs histoires anonymes ont été enregistrées, mises en musique puis réinterprétées par quatre solistes.

12 courts-métrages ont ainsi été tournés sur 12 lieux de la Métropole nancéienne pour restituer ces 12 histoires d'amour.
Nous vous invitons à découvrir ces scènes sur cette carte interactive&nbsp;ou en vous promenant dans Nancy et en flashant les QR Codes affichés sur les lieux de tournage.&nbsp;";false;false;false;2023-10-21
2472;Musée de l'Imprimerie et de la Communication graphique;13 Rue de la Poulaillerie;69002;Lyon;https://www.imprimerie.lyon.fr/fr/edito/eye-eye-eye;;EYE EYE EYE : Voir après le virus et les violences (2015 ? 202?);Expos, musées;Tous publics;VIDÉO|FLUX EN DIRECT|PROGRAMMES EN DIFFÉRÉ|IMAGES|COLLECTIONS NUMÉRISÉES|BASES DE DONNÉES|EXPOSITIONS VIRTUELLES;ARTS VISUELS|AUDIOVISUEL|ÉDUCATION AUX MÉDIAS|MUSÉES|PEINTURE|PHOTOGRAPHIE;;Le temps de manger un sandwich pendant une pause déjeuner;Accès permanent;Collectivité territoriale;;Sous-titrage automatique Youtube;45.76422,4.834752;45.76422;4.834752;69002;10;Exposition numérique en 22 épisodes - Chapitre 1, A perte de vue, 7 épisodes disponibles à partir du 25 mars - Chapitre 2, Circuit des yeux, 7 épisodes disponibles à partir du 08 avril - Chapitre 3, Ouvrir l’œil, 7 épisodes disponibles à partir du 06 mai Cette exposition numérique à découvrir sur YouTube et les réseaux veut nous ouvrir les yeux : comment arrivons-nous encore à voir quelque chose dans ce brouillard, cette brume épaisse qui s’est formée autour de nous ? Comment agir et voir ensemble, après toutes les violences que nos yeux ont subies ces dernières années ? Cet atlas découpé en épisodes, pour rester digeste, cherche à donner le temps de penser ce qui nous arrive, en faisant dialoguer des images libres, en mouvement, qui se répondent et résistent entre elles par nature. C’est la place des musées, et de ce musée, de réagir au présent. De faire surgir des œuvres, des figures, des fantômes, pour contrer l’attaque des images qui nous bouchent la vue. Pour essayer d’accompagner une cicatrisation collective, thérapeutique, encore à venir. Textes et commissariat Joseph Belletante Assisté de Julie Davasse Avec les voix de Camille Varenne et Clémence Zakiri Compagnie Lunée l’Ôtre, artistes en résidence;false;false;false;2023-04-23
945;Ministère de la Culture;3 rue de Valois;75001;Paris;https://www.histoiredesarts.culture.gouv.fr/;;Histoire des arts;Approfondir ses connaissances;Parents / Éducateurs;RESSOURCES PÉDAGOGIQUES;ARCHÉOLOGIE|ARCHITECTURE ET PATRIMOINE|ARTS DÉCORATIFS|DESIGN|MÉTIERS D’ART|ARTS VISUELS|BANDE DESSINÉE|CINÉMA|DANSE|ÉDUCATION ARTISTIQUE ET CULTURELLE|HISTOIRE|LITTÉRATURE|SCIENCES HUMAINES|LANGUES|MONUMENTS HISTORIQUES|MUSÉES|MUSIQUE|CONCERTS ET OPÉRAS|PEINTURE|PHOTOGRAPHIE|SCULPTURE|THÉÂTRE|SPECTACLES;;Toute une vie ne suffit pas;Accès permanent;Ministère de la Culture ou opérateur national;;;48.863666,2.337933;48.863666;2.337933;75001;150;Edité par le ministère de la Culture, le site Histoire des arts, propose près de 5000 ressources commentées pour l'enseignement de l'histoire des arts : dossiers pédagogiques, expositions virtuelles, vidéos... ainsi que des repères chronologiques par domaines artistiques.;true;false;false;2022-10-24
2525;Maison natale Claude-Debussy;38 rue au Pain;78100;Saint germain en laye;https://www.saintgermainenlaye.fr/736/musee-municipal.htm;;Napoléon chef de guerre, chef d'Etat;Expos, musées;Tous publics;EXPOSITIONS VIRTUELLES;HISTOIRE|MUSÉES|SCULPTURE;;Le temps de manger un sandwich pendant une pause déjeuner;Accès permanent;Collectivité territoriale;;;48.89691,2.092649;48.89691;2.092649;78100;10;"Visite virtuelle de l'exposition ""Napoléon chef de guerre, chef d'Etat"" organisée par le musée municipal de Saint-Germain-en-Laye";false;false;false;2024-05-26
2572;UMA (Universal Museum of Art);90 rue de la Folie-Méricourt;75011;Paris;http://expo.the-uma.org/notre_dame/;;"Exposition virtuelle ""Notre-Dame dans la peinture, du XVIème au XXème siècle""";Expos, musées;Tous publics;EXPOSITIONS VIRTUELLES;ARCHITECTURE ET PATRIMOINE|PEINTURE;AUDIODESCRIPTION (AD)|FACILE À LIRE ET À COMPRENDRE (FALC);Le temps de manger un sandwich pendant une pause déjeuner;Accès permanent;Organisme privé;;;48.8669,2.36956;48.8669;2.36956;75011;10;Exposition virtuelle regroupant une soixantaine d'oeuvres des plus grands artistes sur la cathédrale Notre-dame de Paris, réalisée au lendemain de l'incendie. Exposition réalisée dans une architecture 3D libre et contemporaine qui rend hommage à ce haut lieu de notre patrimoine.;false;false;true;2023-01-09
2580;Bibliothèques et médiathèques intercommunales - Communauté d'agglomération d'Épinal;48 rue Saint Michel;88000;Épinal;https://www.tiktok.com/@bmiepinal?lang=fr;;La chaîne TikTok des bmi - Épinal;Livres;Tous publics;VIDÉO|FLUX EN DIRECT|PROGRAMMES EN DIFFÉRÉ;HUMOUR ET PERFORMANCES|LITTÉRATURE|SCIENCES HUMAINES|LANGUES;;Le temps de manger un sandwich pendant une pause déjeuner;Accès permanent;Collectivité territoriale;;;48.177807,6.457827;48.177807;6.457827;88000;10;Les bibliothèques et médiathèques du réseau de la Communauté d'agglomération d'Épinal proposent chaque jeudi une vidéo humoristique autour du métier de bibliothécaire.;false;false;false;2025-05-27
2638;Musée d’Art Naïf et des Arts Singuliers de Laval;Place de la Trémoille;52997;Laval;https://musees.laval.fr/360_musee/;;Visite virtuelle du MANAS;Expos, musées;Tous publics;EXPOSITIONS VIRTUELLES;ARTS VISUELS|MUSÉES|PEINTURE|SCULPTURE;;Le temps de manger un sandwich pendant une pause déjeuner;Accès permanent;Collectivité territoriale;;;48.068777,-0.772359;48.068777;-0.772359;52997;10;Découvrez la visite virtuelle du MANAS, un lieu unique consacré aux Arts Naïfs et Singuliers ! Assurant une veille sur la création hors les normes, il est identifié au niveau national comme découvreur et soutien aux plasticiens éloignés des circuits de diffusion.;false;false;false;2023-10-18
2660;Centre national des arts plastiques;73 esplanade Charles de Gaulle;92911;Paris;https://soundcloud.com/cnap-podcast;;Collections sur écoute;Approfondir ses connaissances;Tous publics;AUDIO|RADIO|PODCASTS;ARTS NUMÉRIQUES|ARTS VISUELS|AUDIOVISUEL|ÉDUCATION ARTISTIQUE ET CULTURELLE|PEINTURE|PHOTOGRAPHIE|SCULPTURE;;Le temps de manger un sandwich pendant une pause déjeuner;Accès permanent;Ministère de la Culture ou opérateur national;;;44.837742,-0.584513;44.837742;-0.584513;92911;10;« Collections sur écoute » est un podcast réalisé par Malo Malo pour le Centre national des arts plastiques. Chaque épisode propose à l'auditeur de lui faire découvrir une acquisition récente du Cnap à travers la description et l’analyse des responsables de collection ou des commissaires invités. Une porte d’entrée sur la création artistique d’aujourd’hui et de demain.;false;false;false;2022-10-14
619;Archives départementales - Val-de-Marne;10 rue des archives;94054;Créteil;http://archives.valdemarne.fr/r/55/zoom-sur-/;;Archives en ligne;Approfondir ses connaissances;Tous publics;IMAGES|COLLECTIONS NUMÉRISÉES|BASES DE DONNÉES|EXPOSITIONS VIRTUELLES;ARCHIVES;;Le temps d’une soirée;Accès permanent;Collectivité territoriale;;;48.783523,2.45637;48.783523;2.45637;94054;120;Zoom sur : bibliothèque audiovisuelle, documents d'histoire, ou encore l'épopée du Kayak Club de France.;false;false;false;2025-07-30
701;Centre de Culture Scientifique Technique et Industriel Parc Aux Etoiles;2 rue de la Chapelle;78510;Triel sur Sein;https://parcauxetoiles.gpseo.fr/restons-curieux;;Restons curieux;Audios;Tous publics;VIDÉO|FLUX EN DIRECT|PROGRAMMES EN DIFFÉRÉ|AUDIO|RADIO|PODCASTS;SCIENCES;;Le temps de manger un sandwich pendant une pause déjeuner;Accès permanent;Collectivité territoriale;;;48.998315,2.008893;48.998315;2.008893;78510;10;L'équipe de médiation du Parc Aux Etoiles vous propose tous les jours du lundi au vendredi de rester curieux et de découvrir une thématique scientifique au travers de 5 formats différents.Tous les lundis, avec Cathy découvrez ou redécouvrez notre Univers dans ses podcasts. Les mardis, croisons l'art et les sciences avec Amandine et ses vidéos explicatives d'oeuvres d'art, etc.;false;false;false;2024-09-27
718;Centre national du costume de scène et de la scénographie;Quartier Villars, Route de Montilly;03000;Moulins;https://www.cncs.fr/livrets-jeu;;Livrets-jeu;Approfondir ses connaissances;Parents / Éducateurs;RESSOURCES PÉDAGOGIQUES;MODE;;Le temps d’une soirée;Accès permanent;Organisme labellisé, conventionné ou subventionné par le ministère de la culture;;;46.565557,3.315925;46.565557;3.315925;3000;120;Lors de chaque nouvelle exposition, le service médiation crée un document de jeu pour faciliter la visite des 6-12 ans ! Costumes à découper, à dessiner ou à manipuler sont en téléchargement ici.;false;false;false;2023-06-01
774;Château de Chantilly;7, rue du connétable;60500;Chantilly;https://chateaudechantilly.fr/visites-virtuelles/;;Les expositions virtuelles du château de Chantilly;Approfondir ses connaissances;Tous publics;EXPOSITIONS VIRTUELLES;ARCHITECTURE ET PATRIMOINE|HISTOIRE|MONUMENTS HISTORIQUES|PARCS ET JARDINS;;Le temps d’un vrai déjeuner;Accès gratuit exceptionnel et limité dans le temps;Organisme labellisé, conventionné ou subventionné par le ministère de la culture;;;49.194154,2.480116;49.194154;2.480116;60500;60;Découvrez les expositions virtuelles du domaine de Chantilly pour tout savoir sur l'histoire du lieu et de ses fabuleuses collections.;false;false;false;2025-03-23
799;Espace des sciences Pierre-Gilles de Gennes;10 Rue Vauquelin;75005;Paris;https://www.espgg.org/Confine-ta-science;;Confine Ta Science;Approfondir ses connaissances;Tous publics;VIDÉO|FLUX EN DIRECT|PROGRAMMES EN DIFFÉRÉ;SCIENCES;;Le temps d’un vrai déjeuner;Accès gratuit exceptionnel et limité dans le temps;Organisme privé;;;48.841234,2.347531;48.841234;2.347531;75005;60;L’Espace des Sciences Pierre-Gilles de Gennes (ESPCI Paris – PSL) ferme ses portes, mais son équipe de médiation de l’association TRACES n’arrête pas l’activité pour autant ! Les médiateur·rices proposent chaque semaine des rendez-vous numériques inédits : « Confine ta science : des médiateur·rices à la maison ». Au programme : des rencontres avec des chercheur·euses, des défis, des expériences, et des surprises pour petit·es et grand·es. Un temps d'échange pour explorer ensemble les sciences !;false;false;false;2024-07-24
801;Espace multimédia Gantner;1 rue de la varonne;90140;Bourogne;https://www.espacemultimediagantner.cg90.net/podcasts-audio/;;Discographie / Podcasts;Audios;Tous publics;AUDIO|RADIO|PODCASTS;ARTS NUMÉRIQUES|MUSIQUE|CONCERTS ET OPÉRAS;;Le temps d’un vrai déjeuner;Accès permanent;Collectivité territoriale;;;47.564003,6.917222;47.564003;6.917222;90140;60;Partons à la découverte du fonds discographique de l'Espace Gantner grâce aux podcasts audios réalisés par Xavier Hug qui mettent en lumière des artistes dont l'influence a été majeure pour leurs successeurs.;false;false;false;2025-03-08
907;Le Grand Café - centre d'art contemporain;Place des Quatre z'Horloges;44600;Saint-Nazaire;https://vimeo.com/legrandcafe;;Restons connecté.e.s !;Films, documentaires, vidéos;Tous publics;VIDÉO|FLUX EN DIRECT|PROGRAMMES EN DIFFÉRÉ|EXPOSITIONS VIRTUELLES;ARTS VISUELS;;Le temps d’un vrai déjeuner;Accès permanent;Organisme labellisé, conventionné ou subventionné par le ministère de la culture;;;47.28479,-2.29305;47.28479;-2.29305;44600;60;Le Grand Café poursuit ses activités d’accompagnement et de soutien à la création en augmentant son programme de rendez-vous numériques. Le Grand Café met à la disposition de tou.te.s ses ressources produites, dans un objectif de démocratisation, d'éducation et de partage des connaissances. De même, le centre d’art créé des actualités en ligne spécifiques à ses missions de production d’œuvres, d’exposition, de résidence, de publication, d’accompagnement des publics, etc.;false;false;false;2024-03-08
918;Les Champs Libres;10, cours des Alliés;35000;Rennes;https://soundcloud.com/leschampslibres;;Rencontres & conférences des Champs Libres (Rennes);Audios;Tous publics;AUDIO|RADIO|PODCASTS;ARTS DÉCORATIFS|DESIGN|MÉTIERS D’ART|ARTS VISUELS|LITTÉRATURE|SCIENCES HUMAINES|LANGUES;;Le temps de manger un sandwich pendant une pause déjeuner;Accès permanent;Collectivité territoriale;;;48.105313,-1.674877;48.105313;-1.674877;35000;10;Les Champs Libres (centre culturel rennais) proposent de revivre en podcasts les rencontres, conférences et débats organisés tout au long de l'année : Les enjeux d'Internet : d'Assange à Zuckerberg, La photographie de mode dans la presse ou encore la révolution de l'agroécologie.;false;false;false;2025-04-24
949;Ministère de la Culture;3 rue de Valois;75001;Paris;https://www.culture.gouv.fr/Sites-thematiques/Langue-francaise-et-langues-de-France/Politiques-de-la-langue/Sensibilisation-des-publics/Parler-comme-jamais-le-nouvel-audio-libre-podcast-de-la-langue-francaise;;« Parler comme jamais »;Audios;Tous publics;AUDIO|RADIO|PODCASTS;LITTÉRATURE|SCIENCES HUMAINES|LANGUES;;Le temps de manger un sandwich pendant une pause déjeuner;Accès permanent;Ministère de la Culture ou opérateur national;;;48.863666,2.337933;48.863666;2.337933;75001;10;Laudio libre (podcast) qui déconstruit les clichés de la langue française. Retrouvez les différents épisodes proposés une fois par mois par Laélia Véron, autrice de « Le français est à nous ! », une émission de Bine audio soutenue par la DGLFLF (ministère de la Culture).;false;false;false;2023-01-27
1019;Musée des Beaux-Arts;Le château;14000;Caen;https://mba-caen.yunow.app/672-musee-des-beaux-arts-de-caen/2271-accueil;Maternelle|113|Primaire|Collège;Jouer avec les oeuvres du musée;Jeux;Enfants;JEUX;ARTS VISUELS;;Le temps de manger un sandwich pendant une pause déjeuner;Accès permanent;Collectivité territoriale;;;49.186271,-0.362635;49.186271;-0.362635;14000;10;Nouvel espace jeux mis en ligne sur le site du musée des Beaux-Arts de Caen (mba.caen.fr) 3 jeux interactifs pour découvrir les collections du musée en s'amusant : Puzzle, Mémory et Timeline (classement des tableau dans l'ordre chronologique);false;true;false;2025-08-04
1037;Musée du Louvre;Rue de Rivoli;75001;Paris;https://petitegalerie.louvre.fr/visite-virtuelle/saison5/;;La petite Galerie;Expos, musées;Tous publics;EXPOSITIONS VIRTUELLES;MUSÉES|PEINTURE|SCULPTURE;;Le temps d’un vrai déjeuner;Accès permanent;Ministère de la Culture ou opérateur national;;;48.862527,2.335861;48.862527;2.335861;75001;60;Faites la visite virtuelle de l’exposition de la Petite Galerie du musée du Louvre intitulée « Figure d’Artiste » de chez vous et admirez les autoportraits de Dürer, Rembrandt ou Delacroix .;false;false;false;2024-02-06
1041;Musée du quai Branly - Jacques Chirac;37 quai Branly;75007;Paris;https://www.deezer.com/fr/playlist/4617596344;;Playlist « Aux sources du hip hop »;Audios;Tous publics;AUDIO|RADIO|PODCASTS;ART URBAIN (GRAPH|HIP HOP|STREET ART…)|MUSIQUE|CONCERTS ET OPÉRAS;;Le temps d’une soirée;Accès permanent;Ministère de la Culture ou opérateur national;;;48.8615,2.297744;48.8615;2.297744;75007;120;Cette playlist préparée par l'ethnomusicologue Renaud Brizard reprend des grands tubes de hip hop américain et français, et les enregistrements de musiques traditionnelles du monde entier qui les ont inspirés !;false;false;false;2025-06-29
1053;Musée municipal de Pontarlier;2 place d'Arçon;25300;Pontarlier;https://www.ville-pontarlier.fr/page/activites-et-loisirs/activites-culture/musee-municipal/preparer-votre-visite;;Podcasts;Audios;Tous publics;AUDIO|RADIO|PODCASTS;ARCHÉOLOGIE|HISTOIRE|MUSÉES;;Le temps de manger un sandwich pendant une pause déjeuner;Accès permanent;Collectivité territoriale;;;46.904108,6.354871;46.904108;6.354871;25300;10;A travers ces dix-neufs fichiers audio ou vidéo de 2 ou 3 min chacun, vous découvrez les différentes thématiques des collections du Musée de Pontarlier ou vous vous attardez sur quelques œuvres emblématiques. Peinture comtoise, archéologie et histoire du territoire, histoire de l'absinthe n'auront plus de secret pour vous.;false;false;false;2025-02-16
1070;Musée Yves Saint Laurent;5 Avenue Marceau;75116;Paris;https://museeyslparis.com/biographie;;Biographies interactives;Expos, musées;Tous publics;EXPOSITIONS VIRTUELLES;MODE;;Le temps de manger un sandwich pendant une pause déjeuner;Accès permanent;Organisme privé;;;48.865621,2.29952;48.865621;2.29952;75116;10;Elles retracent la vie d’Yves Saint Laurent et de Pierre Bergé. Vie privée, créations emblématiques, histoire de leur maison de couture, engagements personnels… Sélectionnez vos thèmes favoris et parcourez les temps forts de ces destins hors-normes.;false;false;false;2024-12-22
1181;TAP - Théâtre Auditorium;1 boulevard de Verdun;86000;Poitiers;https://vimeo.com/channels/instantanes/videos;;Les Instantanés - Cécilia Bengolea & François Chaignaud;Films, documentaires, vidéos;Tous publics;VIDÉO|FLUX EN DIRECT|PROGRAMMES EN DIFFÉRÉ;DANSE;;Le temps de manger un sandwich pendant une pause déjeuner;Accès permanent;Organisme labellisé, conventionné ou subventionné par le ministère de la culture;;;46.583617,0.337101;46.583617;0.337101;86000;10;Chaque jour à 17h, nous ouvrons notre collection d'Instantanés, ce sont de courtes vidéo que nous avons tournées avec des artistes programmés au TAP. La règle : tourner sans préparation, en plan séquence, en une seule prise pour obtenir une captation de l’instant.;false;false;false;2023-04-11
999;Musée de la Chasse et de la Nature;62, rue des Archives;75003;Paris;https://www.chassenature.org/nos-videos/;;Revivez les temps forts du musée;Approfondir ses connaissances;Tous publics;VIDÉO|FLUX EN DIRECT|PROGRAMMES EN DIFFÉRÉ;ARCHITECTURE ET PATRIMOINE|ARTS DÉCORATIFS|DESIGN|MÉTIERS D’ART|MUSÉES;;Le temps de manger un sandwich pendant une pause déjeuner;Accès permanent;Organisme privé;;;48.861498,2.358616;48.861498;2.358616;75003;10;Musée, expositions, événements;false;false;false;2022-10-06
1025;Musée des Beaux-Arts de Nancy;3 Place Stanislas;54000;Nancy;https://www.flickr.com/photos/127078033@N04/albums;;Expositions virtuelles;Expos, musées;Tous publics;IMAGES|COLLECTIONS NUMÉRISÉES|BASES DE DONNÉES;ARTS DÉCORATIFS|DESIGN|MÉTIERS D’ART|MUSÉES|PEINTURE;FACILE À LIRE ET À COMPRENDRE (FALC);Le temps de manger un sandwich pendant une pause déjeuner;Accès permanent;Collectivité territoriale;Arts graphiques;;48.693486,6.182404;48.693486;6.182404;54000;10;Expositions virtuelles qui reprennent les accrochages des collections réalisés au musée sur différentes thématiques (L'art et la guerre, l'orientalisme,...) ou différents artistes (Jacques Callot, Grandville,...). Textes et visuels des oeuvres se succèdent ainsi que quelques photographies de la muséographie de ces expositions. Les arts graphiques sont largement représentés dans ces albums;false;false;true;2023-12-10
1110;Orchestre de Douai;100 Rue Pierre Dubois;59500;Douai;https://www.orchestre-douai.fr/jeunes-publics/;;L'orchestre en vidéo;Concerts, spectacles;Tous publics;VIDÉO|FLUX EN DIRECT|PROGRAMMES EN DIFFÉRÉ;MUSIQUE|CONCERTS ET OPÉRAS;;Le temps d’une soirée;Accès permanent;Collectivité territoriale;;;50.374203,3.086093;50.374203;3.086093;59500;120;Découvrez le répertoire de l'Orchestre de Douai à travers de nombreuses vidéos : extraits de concerts, répétitions filmées et interviews;false;false;false;2024-02-19
2129;Théâtre du Châtelet;2 rue Edouard Colonne;75001;Paris;https://www.youtube.com/playlist?list=PLFn-zeVP25nsJQS-WqI7YfjyJiJD8C3c_;;Le Châtelet sur le toit;Concerts, spectacles;Tous publics;VIDÉO|FLUX EN DIRECT|PROGRAMMES EN DIFFÉRÉ;DANSE|MUSIQUE|CONCERTS ET OPÉRAS;;Le temps de manger un sandwich pendant une pause déjeuner;Accès permanent;Collectivité territoriale;;;48.857845,2.345636;48.857845;2.345636;75001;10;Le Châtelet prend de la hauteur et installe sa scène numérique dans un lieu insolite. Une programmation exclusive de performances sur le toit du Théâtre du Châtelet.;false;false;false;2023-08-14
2197;France Télévisions;7 esplanade Henri-de-France;75015;Paris;https://www.lumni.fr/programme/la-fabrique-du-mensonge;;La fabrique du mensonge (Lumni);Films, documentaires, vidéos;Tous publics;VIDÉO|FLUX EN DIRECT|PROGRAMMES EN DIFFÉRÉ;ÉDUCATION AUX MÉDIAS;SOUS-TITRAGE (ST);Le temps d’un vrai déjeuner;Accès permanent;Ministère de la Culture ou opérateur national;;;48.839003,2.270817;48.839003;2.270817;75015;60;Comment naissent et se propagent les fake news ? Qui en sont les instigateurs ? Comment ont contre attaqué ceux qui en ont été la cible ? La Fabrique du mensonge, collection documentaire en 6 épisodes décortique les infos à travers des exemples marquants de l'actualité : Brexit, vaccins, présidentielles française et américaine,...;false;false;true;2022-08-15
2243;Château de Versailles;Place d'armes;78000;Versailles;https://artsandculture.google.com/search/exhibit?p=palace-of-versailles;;Expositions en ligne;Expos, musées;Tous publics;EXPOSITIONS VIRTUELLES;HISTOIRE|MODE|MONUMENTS HISTORIQUES|PEINTURE|SCIENCES;;Le temps d’un week-end;Accès permanent;Ministère de la Culture ou opérateur national;;;50.959524,1.850232;50.959524;1.850232;78000;2880;Le château de Versailles s'est associé à Google arts et culture pour vous proposer 18 histoires autour de la science, de la mode, des arts de la table ou encore des monarques qui ont fait vivre le château.;true;false;false;2024-02-29
2325;Radio France;116 avenue du Président Kennedy;75016;Paris;https://www.franceinter.fr/emissions/l-effet-domino;;L'effet domino;Actualités, débats;Tous publics;AUDIO|RADIO|PODCASTS;ÉDUCATION AUX MÉDIAS;;Le temps d’une soirée;Accès permanent;Organisme labellisé, conventionné ou subventionné par le ministère de la culture;;;48.852149,2.279529;48.852149;2.279529;75016;120;Une série audio sur l'impact des réseaux sociaux. Des millions de personnes likent, commentent, retweetent des posts d’inconnus. Des actions apparemment anodines qui propulsent certains profils dans la lumière numérique et médiatique.;false;false;false;2022-11-30
2439;Les éditions Marcomir;34 Avenue des champs-élysées;75008;Paris;https://www.youtube.com/watch?v=TGCAVao53Sg&list=PLTxLQH1K_AW0wIQQCBHmJO3o4v1_waRYQ;;#Poésiepourlanuit;Films, documentaires, vidéos;Tous publics;VIDÉO|FLUX EN DIRECT|PROGRAMMES EN DIFFÉRÉ;LITTÉRATURE|SCIENCES HUMAINES|LANGUES;SOUS-TITRAGE (ST);Le temps de manger un sandwich pendant une pause déjeuner;Accès permanent;Organisme privé;;;48.869965,2.308164;48.869965;2.308164;75008;10;Découvrez les plus beaux textes de la poésie française lus par des comédiens professionnels, avec une court commentaire de l’œuvre en description de la vidéo!;false;false;true;2022-05-27
2533;La Maison de l'Image;97 galerie de l'Arlequin;38100;Grenoble;https://ezproduction.fr/vv/mdp.html;;Visite virtuelle du Mois de la Photo 2020;Expos, musées;Tous publics;EXPOSITIONS VIRTUELLES;ARTS VISUELS|PHOTOGRAPHIE;;Le temps d’un vrai déjeuner;Accès permanent;Organisme privé;;;45.164079,5.732875;45.164079;5.732875;38100;60;Plongez au cœur du Mois de la Photo 2020 à Grenoble... de chez vous grâce à la visite virtuelle à 360°. Quatre photographes exposés explorent des paysages mémoriels complexes des histoires individuelles et de la grande. Ils questionnent la mémoire collective, la reconstruction et l’oubli, la mémoire fantôme ou fugitive en explorant la richesse infinie de la thématique de cette huitième édition du Mois de la Photo à Grenoble - les Mémoires. Découvrez des photographies d’Aletheia Casey, Jef Bonifacino, Camille Carbonaro et Marie Mons depuis chez vous, mais aussi des vidéos de présentation et d’œuvres commentées par les artistes !;false;false;false;2022-01-19
