id;org_nom;org_adresse;code_postal;commune;url;niveau_enfant;titre;activite;public;type_ressource;thematiques;handicap_adapt;duree_txt;perennite;rattachement;thematique_autre;autre_precise;geo;lat;lon;code_postal_num;duree_min;description;long_duration;is_for_kids;is_accessible;date
1953;Musée Bonnat-Helleu, musée des beaux-arts de Bayonne;5 rue Jacques-Laffitte;64100;Bayonne;https://vimeo.com/channels/mbhbayonne/page:1;;Raphaël à Bayonne - micro-trottoirs;Expos, musées;Tous publics;VIDÉO|FLUX EN DIRECT|PROGRAMMES EN DIFFÉRÉ;ARTS VISUELS|HISTOIRE|MUSÉES|PEINTURE;SOUS-TITRAGE;Le temps de manger un sandwich pendant une pause déjeuner;Accès permanent;Collectivité territoriale;;;43.491987,-1.472339;43.491987;-1.472339;64100;10;Vidéos courtes et ludiques présentant une partie du fonds de dessins de Raffaello Sanzio, dit Raphaël (1483-1520), conservés au musée Bonnat-Helleu.;false;false;true;2023-02-20
624;Archives départementales - Yvelines;2 avenue de Lunca;78180;Montigny-le-Bretonneux;https://educarchives.yvelines.fr/;;Archives en ligne;Approfondir ses connaissances;Tous publics;IMAGES|COLLECTIONS NUMÉRISÉES|BASES DE DONNÉES|EXPOSITIONS VIRTUELLES;ARCHIVES;;Le temps d’une soirée;Accès permanent;Collectivité territoriale;;;48.789645,2.045773;48.789645;2.045773;78180;120;"Consultation de documents numérisés, d'expositions virtuelles; participation à des projets collaboratifs : ""Adoptez un poilu"" (projet d'indexation des fiches matricules des soldats de la Grande Guerre), ""C'est quoi ce chantier?"" (projet de crowdsourcing portant sur des chantiers des Yvelines), ""Tous en résidence"" (projet d'éducation artistique et culturelle).";false;false;false;2023-06-25
634;Archives municipales;3 rue Henri-Bazin;54000;Nancy;http://archives.nancy.fr/action-culturelle/expositions/;;Archives en ligne;Approfondir ses connaissances;Tous publics;IMAGES|COLLECTIONS NUMÉRISÉES|BASES DE DONNÉES;ARCHIVES;;Le temps d’une soirée;Accès permanent;Collectivité territoriale;;;48.69593,6.190546;48.69593;6.190546;54000;120;Recherche dans les fonds, consultation d'archives numérisées (cartes postales, cartes et plans, estampes et photographies), expositions virtuelles, dossiers pédagogiques pour les enseignants (ou les parents). Fiches conseils et tableau de tri pour gérer les archives familiales. Projets collaboratifs : transcription de documents, aide à la reconnaissance de photographies. Enigme du jour et mots-croisés (pendant la période du confinement) aussi sur Facebook.;false;false;false;2023-03-07
635;Archives municipales;Place de l'Hôtel de Ville;11100;Narbonne;http://expositionarchives.mairie-narbonne.fr;;Les archives de Narbonne se dévoilent;Expos, musées;Tous publics;JEUX|EXPOSITIONS VIRTUELLES;HISTOIRE;;Le temps d’un vrai déjeuner;Accès permanent;Collectivité territoriale;;;43.183834,3.004129;43.183834;3.004129;11100;60;Exposition virtuelle éphémère présentant les ressources des archives municipales de Narbonne : sélection de documents consacrés aux arts et divertissements. Découvrez le Palais des sports, des arts et du travail de Narbonne, les sports, les fêtes, les arts du spectacle et les jeux à travers une sélection de documents d'archives issus des archives de Narbonne. Elle s'accompagne de jeux pour découvrir ou redécouvrir Narbonne.;false;false;false;2022-07-20
641;Archives nationales d'outre-mer;29, chemin du moulin de Testas;13001;Aix-en-Provence;http://www.archivesnationales.culture.gouv.fr/anom/fr/Action-culturelle/Dossiers-thematiques.html;;Dossiers thématiques;Approfondir ses connaissances;Tous publics;IMAGES|COLLECTIONS NUMÉRISÉES|BASES DE DONNÉES|EXPOSITIONS VIRTUELLES;ARCHIVES;;Le temps d’une soirée;Accès permanent;Ministère de la Culture ou opérateur national;;;43.514486,5.447973;43.514486;5.447973;13001;120;Réalisés à partir des fonds documentaires : des représentations de la ville d'Hanoï aux bagnes de Guyane, en passant par les costumes de l'Union française.;false;false;false;2022-08-22
650;Association - Jeunesses musicales de France;20 Rue Geoffroy l'Asnier;75004;Paris;https://www.youtube.com/playlist?list=PLxS3PCGAdJg6yixehIUdDX-h_WzGY28_K;;Ma (ré)création musicale;Approfondir ses connaissances;Parents / Éducateurs;VIDÉO|FLUX EN DIRECT|PROGRAMMES EN DIFFÉRÉ;MUSIQUE|CONCERTS ET OPÉRAS;;Le temps de manger un sandwich pendant une pause déjeuner;Accès gratuit exceptionnel et limité dans le temps;Organisme labellisé, conventionné ou subventionné par le ministère de la culture;;;48.85473,2.356399;48.85473;2.356399;75004;10;Pour que tous les enfants aient accès à la musique, quelles que soient les circonstances ! Afin de maintenir le lien avec les milliers d’enfants chez eux en ce moment, les JM France ont invité tous leurs artistes à envoyer leur « (ré)création musicale ». Chacune présentera un petit défi artistique, à relever en famille !;false;false;false;2023-07-02
651;Alienor.org - Conseil des musées;3bis Rue Jean-Jaurès;86000;Grand Poitiers;https://www.alienor.org/;;52 musees en 1 site;Expos, musées;Tous publics;EXPOSITIONS VIRTUELLES;ARCHÉOLOGIE|MUSÉES;;Le temps de manger un sandwich pendant une pause déjeuner;Accès permanent;Organisme labellisé, conventionné ou subventionné par le ministère de la culture;;;46.580206,0.346577;46.580206;0.346577;86000;10;En cette période de confinement, retrouvez les musiciens de l'Orchestre dans des vidéos inédites et des captations de concerts. Découvrez ou redécouvrez les grands classiques du répertoire avec des conférences en facebook live animées par une musicologue.;false;false;false;2025-05-30
660;Audible France;32 Rue de Mogador;75009;Paris;https://stories.audible.com/discovery/enterprise-discovery-21122523011?ipRedirectOverride=true;;Audible Stories;Livres;Enfants;LIVRES NUMÉRIQUES;LITTÉRATURE|SCIENCES HUMAINES|LANGUES;;Le temps d’une soirée;Accès permanent;Organisme privé;;;48.875808,2.331292;48.875808;2.331292;75009;120;Des livres audio gratuits avec Audible Stories ! Les enfants vont pouvoir s’évader grâce aux livres audio ! Audible met à disposition un service de streaming gratuit et sans inscription de livres audio jeunesse et de classiques.;false;false;false;2022-02-25
724;Centre-Sciences;72 Faubourg de Bourgogne;45000;Orléans;https://www.youtube.com/channel/UCPithPDiY2KKp3EwgbhVXiw/videos;;Les Sciences on tourne !;Approfondir ses connaissances;Tous publics;VIDÉO|FLUX EN DIRECT|PROGRAMMES EN DIFFÉRÉ;SCIENCES;;Le temps de manger un sandwich pendant une pause déjeuner;Accès permanent;Collectivité territoriale;;;47.902314,1.927295;47.902314;1.927295;45000;10;Conférences scientifiques données par des scientifiques, des chercheurs filmés dans leur laboratoire qui illustrent leur propos par des expériences, des manipulations, des observations, des images de science, etc. Chacun peut s'immergerez dans la vie quotidienne d’un chercheur sur son lieu de travail. Pour les lycéens et les collègiens;false;false;false;2025-06-12
757;Compagnie propos;9 Rue Professeur Morat;69008;Lyon;https://www.compagnie-propos.com/radioguidages-d-interieur;;Radioguidages d'intérieur;Audios;Tous publics;AUDIO|RADIO|PODCASTS;DANSE;;Le temps d’un vrai déjeuner;Accès permanent;Organisme labellisé, conventionné ou subventionné par le ministère de la culture;;;45.735339,4.881126;45.735339;4.881126;69008;60;Une façon originale de s'amuser et de danser chez soi. Le principe est très simple : il suffit de lancer le fichier audio et de suivre les consignes données par Denis Plassard. Chaque radioguidage peut être refait plusieurs fois si on le souhaite, car la façon d'interpréter les consignes peut changer à chaque écoute.;false;false;false;2024-11-21
824;Fonds régional d'art contemporain - Centre-Val de Loire;88 Rue du Colombier;45000;Orléans;http://www.frac-centre.fr/scolaires/parcours-pedagogiques-788.html;;Parcours pédagogiques;Approfondir ses connaissances;Parents / Éducateurs;RESSOURCES PÉDAGOGIQUES;ARTS DÉCORATIFS|DESIGN|MÉTIERS D’ART;;Le temps d’un week-end;Accès permanent;Ministère de la Culture ou opérateur national;;;47.903572,1.901082;47.903572;1.901082;45000;2880;"Le Frac Centre-Val de Loire propose quatre parcours pédagogiques, transversaux entre les enseignements artistiques, scientifiques, littéraires ou technologiques : Architecture &amp; Nature, Villes, Mobilité &amp; Architecture, Vivre autrement.";true;false;false;2024-01-08
921;Littérature jeunesse libre;45, rue Paul Lafargue;69100;Villeurbanne;http://litterature-jeunesse-libre.fr/bbs/;Maternelle|126|Primaire;Plus de 1 000 livres jeunesse gratuits;Livres;Enfants;LIVRES NUMÉRIQUES;LITTÉRATURE|SCIENCES HUMAINES|LANGUES;;Toute une vie ne suffit pas;Accès permanent;Organisme privé;;;45.76586,4.883785;45.76586;4.883785;69100;150;Ce site met à votre disposition 1 000 livres qui sont élevés dans le domaine public ou proposés sous licence libre. Vous avez donc le droit de les lire, de les copier, de les redistribuer, de les modifier librement.;true;true;false;2023-12-17
995;Musée de l'Air et de l'Espace – Aéroport de Paris-le Bourget;3, esplanade de l'Air et de l'Espace – Aéroport de Paris-Le Bourget;93352;Le Bourget;https://www.youtube.com/user/museedelair/videos;;Musée de l'Air et de l'Espace sur YouTube;Approfondir ses connaissances;Tous publics;VIDÉO|FLUX EN DIRECT|PROGRAMMES EN DIFFÉRÉ|IMAGES|COLLECTIONS NUMÉRISÉES|BASES DE DONNÉES|EXPOSITIONS VIRTUELLES|CRÉATION ET PRATIQUES ARTISTIQUES;MUSÉES|SCIENCES;;Le temps d’un week-end;Accès permanent;Ministère de la Culture ou opérateur national;;;48.944426,2.432786;48.944426;2.432786;93352;2880;Jeux et tutos, vidéos de derniers vols d'appareils, découverte des métiers de l'aérien ou encore visites guidées avec des experts;true;false;false;2023-04-02
996;Musée de l'Assistance publique - Hôpitaux de Paris;3 avenue Victoria;75004;Paris;https://www.aphp.fr/musee-patrimoine-revue;;Petites histoires d'une grande institution hospitalière;Livres;Tous publics;LIVRES NUMÉRIQUES;ARCHITECTURE ET PATRIMOINE|SCIENCES|MUSÉES;;Le temps de manger un sandwich pendant une pause déjeuner;Accès permanent;Ministère de la Culture ou opérateur national;;;48.856842,2.350388;48.856842;2.350388;75004;10;Patrimoine en revue est une publication proposée par le Musée de l'AP-HP. À travers les collections du musée, découvrez l'histoire et le patrimoine du plus grand CHU d'Europe : l'Assistance publique - Hôpitaux de Paris.;false;false;false;2025-06-06
1009;Musée départemental Albert-Kahn;1, rue des Abondances;92100;Boulogne-Billancourt;http://14-18.albert-kahn.hauts-de-seine.fr/;;Les Archives de la planète numérisées;Expos, musées;Tous publics;IMAGES|COLLECTIONS NUMÉRISÉES|BASES DE DONNÉES;ARCHIVES|MUSÉES;TRANSCRIPTION TEXTUELLE;Le temps d’un vrai déjeuner;Accès permanent;Collectivité territoriale;;;48.841584,2.228989;48.841584;2.228989;92100;60;65000 autochromes numérisées (l'ancêtre de la photographie), les Archives de la Planète, prises entre 1909 et 1931 à travers la planète, ensemble d'images fixes et animées, consacré à la diversité des peuples et des cultures.;false;false;true;2024-07-03
1010;Musée départemental d'art ancien et contemporain;1, Place Lagarde;88000;Epinal;https://museedepartemental.vosges.fr/collections/les-collections;;Collections en ligne;Approfondir ses connaissances;Tous publics;IMAGES|COLLECTIONS NUMÉRISÉES|BASES DE DONNÉES;ARCHITECTURE ET PATRIMOINE|MUSÉES;;Le temps d’un vrai déjeuner;Accès permanent;Collectivité territoriale;;;48.173261,6.446596;48.173261;6.446596;88000;60;Sélection d’œuvres et objets exposés en salles ou conservés en réserves : œuvres majeures, domaines, collections ou thématiques laissent entrevoir toute la richesse et la diversité des collections.;false;false;false;2024-02-15
1056;Musée national de l'histoire de l'immigration (EPPD);293 av Daumesnil;75012;Paris;https://cartes.histoire-immigration.fr/fr/cartes/galerie-des-dons;;Des récits de vie qui font l'histoire de l'immigration;Films, documentaires, vidéos;Tous publics;VIDÉO|FLUX EN DIRECT|PROGRAMMES EN DIFFÉRÉ;HISTOIRE|MUSÉES;;Le temps d’un vrai déjeuner;Accès permanent;Ministère de la Culture ou opérateur national;;;48.834638,2.409586;48.834638;2.409586;75012;60;La collection société du Musée national de l’histoire de l’immigration est constitué d'objets, de documents et de photographies. Ils nous permettent d’aborder, à travers des témoignages, un parcours, individuel ou collectif, dont les migrations sont le sujet principal. On pourra ainsi découvrir l’histoire de familles ordinaires ou se plonger dans le parcours de réfugiés politiques et d’engagés volontaires. Ces parcours font l’objet d’entretiens filmés réunis sur cette carte interactive.;false;false;false;2024-12-10
1059;Musée national des arts asiatiques - Guimet;6 Place d'Iéna;75116;Paris;https://www.guimet-grandidier.fr;;La collection de céramiques chinoises d’Ernest Grandidier;Expos, musées;Tous publics;IMAGES|COLLECTIONS NUMÉRISÉES|BASES DE DONNÉES;ARTS DÉCORATIFS|DESIGN|MÉTIERS D’ART|MUSÉES|PHOTOGRAPHIE;;Le temps d’un vrai déjeuner;Accès permanent;Ministère de la Culture ou opérateur national;;;48.865019,2.293702;48.865019;2.293702;75116;60;Cette collection constitue l’un des ensembles les plus riches conservés en Occident. Cette exposition virtuelle propose de l'explorer et de découvrir certains de ses chefs-d’œuvre aujourd'hui conservés au musée national des arts asiatiques - Guimet.;false;false;false;2022-11-14
1083;Muséum de Bordeaux - sciences et nature;5 place Bardineau;33000;Bordeaux;https://www.museum-bordeaux.fr/accueil/offre-pedagogique/scolaires/ateliers-hors-les-murs;Collège|Lycée;Ateliers hors les murs : le muséum chez vous;Approfondir ses connaissances;Parents / Éducateurs;RESSOURCES PÉDAGOGIQUES;MUSÉES|SCIENCES;;Le temps de manger un sandwich pendant une pause déjeuner;Accès permanent;Collectivité territoriale;;;44.848378,-0.580165;44.848378;-0.580165;33000;10;Une équipe fantastique est une série de vidéos qui présente les différents métiers exercés au Muséum de Bordeaux. Ces vidéos apportent un éclairage sur les compétences et missions du Muséum de Bordeaux - sciences et nature.;false;true;false;2024-06-03
1154;Rencontres de la photographie;34 Rue du Dr Fanton;13200;Arles;https://observervoir.rencontres-arles.com/;;Observer, voir;Approfondir ses connaissances;Parents / Éducateurs;RESSOURCES PÉDAGOGIQUES;PHOTOGRAPHIE;;Le temps d’un vrai déjeuner;Accès permanent;Organisme labellisé, conventionné ou subventionné par le ministère de la culture;;;43.678242,4.625807;43.678242;4.625807;13200;60;La plateforme d'éducation au regard des rencontres d'Arles;false;false;false;2023-11-09
1155;Rennes Ville et Métropole;4 avenue Henri Fréville;35200;Rennes;https://metropole.rennes.fr/le-coin-lecture;;Le coin lecture;Livres;Tous publics;LIVRES NUMÉRIQUES;LITTÉRATURE|SCIENCES HUMAINES|LANGUES;NAVIGATION AU CLAVIER;Le temps d’un vrai déjeuner;Accès permanent;Collectivité territoriale;;;48.093066,-1.67494;48.093066;-1.67494;35200;60;Faites le plein d'idées culture pour toute la famille ! Podcasts, énigmes, vidéos, jeux, récits longs, explorations urbaines... Dans le coin lecture, on vous donne toutes les clefs pour remplir vos journées.;false;false;true;2024-04-18
1194;Théâtre du Soleil;2 Route du Champ de Manoeuvre;75012;Paris;https://vimeo.com/theatredusoleil/videos;;Chaîne Viméo;Concerts, spectacles;Tous publics;VIDÉO|FLUX EN DIRECT|PROGRAMMES EN DIFFÉRÉ;THÉÂTRE|SPECTACLES;;Le temps de manger un sandwich pendant une pause déjeuner;Accès permanent;Collectivité territoriale;;;48.834716,2.449079;48.834716;2.449079;75012;10;Extraits, pièces, rencontres, interviews...;false;false;false;2023-12-21
1248;Musée d'Orsay;1 Rue de la Légion d'Honneur;75007;Paris;https://www.musee-orsay.fr/fr/outils-transversaux/galerie-video/galerie-video.html;;Galerie vidéo;Expos, musées;Tous publics;VIDÉO|FLUX EN DIRECT|PROGRAMMES EN DIFFÉRÉ;MUSÉES|PEINTURE;;Le temps d’une soirée;Accès permanent;Ministère de la Culture ou opérateur national;;;48.86045,2.325696;48.86045;2.325696;75007;120;"Toutes les vidéos du Musée d'Orsay : Un regard une oeuvre, toutes les expositions,&nbsp;Ce qui se cache derrière les petites phrases des grands artistes, etc.";false;false;false;2024-02-05
1280;Institut Lumière;25 rue du Premier-Film;69008;Lyon;https://www.youtube.com/playlist?list=PLaLwsvt3EwlIvjs5HvNHb633wVeusepQC;;Histoires de cinéma;Approfondir ses connaissances;Tous publics;VIDÉO|FLUX EN DIRECT|PROGRAMMES EN DIFFÉRÉ;CINÉMA;;Le temps d’un week-end;Accès permanent;Organisme labellisé, conventionné ou subventionné par le ministère de la culture;;;45.744977,4.870474;45.744977;4.870474;69008;2880;"Conférences filmées sur l'histoire du cinéma : Stanley Kubrick par Michel Ciment, Soirée Bruce Lee, rencontre avec Bernard Benoliel, Comment le cinéma revisite l'Antiquité"", 70 années de cinéma soviétique"" par Joël Chapron,...";true;false;false;2024-12-18
1289;Insula orchestra;la Seine Musicale 1 ile Seguin;92100;Boulogne-Billancourt;https://www.youtube.com/channel/UCbDue_BAPzIDqP6tDyLlGKw/playlists;;Chaine Youtube Insula Orchestra;Films, documentaires, vidéos;Tous publics;VIDÉO|FLUX EN DIRECT|PROGRAMMES EN DIFFÉRÉ;MUSIQUE|CONCERTS ET OPÉRAS;;Le temps d’une soirée;Accès permanent;Organisme privé;;;48.827738,2.234788;48.827738;2.234788;92100;120;Découvrez la chaine Youtube d'Insula orchestra. L'orchestre joue sur instruments d’époque un répertoire allant principalement du classicisme au romantisme et présente des programmes aussi bien symphoniques qu’avec chœur et solistes ou lyriques.;false;false;false;2024-06-08
1360;Paris Musées;27 rue des petites écuries;75010;Paris;http://missionzigomar.paris.fr/;;Mission Zygomar;Jeux;Tous publics;JEUX;ARTS VISUELS|ARTS NUMÉRIQUES;;Le temps d’une soirée;Accès permanent;Collectivité territoriale;;;48.873636,2.351538;48.873636;2.351538;75010;120;En route pour les musées de la ville de Paris ! Mission Zigomar est un site ludo-éducatif qui permet d’explorer les collections de l’ensemble des musées de la Ville de Paris. Durant cette véritable aventure animée, les enfants doivent résoudre des énigmes, emmenés par de jeunes héros;false;false;false;2025-05-04
1367;Class'Code;L'atrium, 43 boulevard du 11 novembre 1918;69100;Villeurbanne;https://pixees.fr/classcode-v2/;;Class'Code;Approfondir ses connaissances;Tous publics;RESSOURCES PÉDAGOGIQUES;ARTS NUMÉRIQUES|SCIENCES;;Toute une vie ne suffit pas;Accès permanent;Organisme privé;;;45.778922,4.864823;45.778922;4.864823;69100;150;Class’Code, est un programme de formation innovant, qui forme depuis 2016 les professionnels de l’éducation et de l’animation pour leur donner les moyens d’initier plsu jeunes à la pensée informatique : programmation créative, codage de l’information, robotique ludique et enjeux sociétaux liés.;true;false;false;2023-10-14
1381;Association Superposition;Place Bellevue;69001;Lyon;https://www.sprayingboard.com/exposition/;;Spraying Board;Expos, musées;Tous publics;EXPOSITIONS VIRTUELLES;ART URBAIN (GRAPH|HIP HOP|STREET ART…);;Le temps d’un vrai déjeuner;Accès permanent;Collectivité territoriale;;;45.774816,4.836297;45.774816;4.836297;69001;60;Spraying Board met à l’honneur la culture du skate et l’art urbain à travers une exposition itinérante. En véritable point de confluence de ces deux pratiques, Spraying Board croise le regard d’une pléiade d’artistes pour lesquels la ville représente un terrain d’expression grandeur nature, une vitrine de leurs créations et un territoire invitant à la réappropriation par toutes et tous.;false;false;false;2022-11-21
1439;Musée d'art et d'histoire du Judaïsme;Hôtel de Saint-Aignan, 71 Rue du Temple;75004;Paris;https://www.mahj.org/fr/ressources-ressources-documentaires/enregistrements-audios;;Enregistrements audio;Audios;Tous publics;AUDIO|RADIO|PODCASTS;MUSÉES;;Le temps d’un vrai déjeuner;Accès permanent;Organisme labellisé, conventionné ou subventionné par le ministère de la culture;;;48.577367,2.584183;48.577367;2.584183;75004;60;Revivez certaines visites et rencontres dans les salles à travers ces enregistrements audios du mahJ (autour des expositions, la parole aux chercheurs, le regard de... etc.);false;false;false;2023-08-24
1448;Opéra Comique;1 Place Boieldieu;75002;Paris;https://www.opera-comique.com/fr/spectacles#chez-vous;;Les spectacles en replay;Concerts, spectacles;Tous publics;VIDÉO|FLUX EN DIRECT|PROGRAMMES EN DIFFÉRÉ;MUSIQUE|CONCERTS ET OPÉRAS;;Le temps d’un vrai déjeuner;Accès permanent;Organisme labellisé, conventionné ou subventionné par le ministère de la culture;;;48.870671,2.337655;48.870671;2.337655;75002;60;L'opéra comique propose des opéras à votre disposition en replay. Pour chacune des oeuvres, nous vous proposons des contenus (programme, interviews, photos, dossiers pédagogiques...), pour que l'expérience du spectacle se rapproche le plus de ce que vous pourriez vivre in situ.;false;false;false;2022-05-22
1555;Archives départementales de Maine-et-Loire;106, rue de Frémur;49000;ANGERS;https://www.archives49.fr/le-temps-suspendu/;;Le temps suspendu;Approfondir ses connaissances;Tous publics;RESSOURCES PÉDAGOGIQUES|CRÉATION ET PRATIQUES ARTISTIQUES;ARCHIVES|HISTOIRE;NAVIGATION AU CLAVIER;Le temps d’un week-end;Accès permanent;Collectivité territoriale;;;47.457846,-0.559917;47.457846;-0.559917;49000;2880;Cette rubrique est composée d'éléments de ressources destinée au public de tous âges (enfants, familles, adultes, seniors) : fiches d'activités et coloriages, documentaire « Témoins de la nuit », puzzles en ligne... voici des suggestions et des idées pour vous distraire et vous cultiver à la maison.;true;false;true;2023-02-22
1598;Centre d'action sociale de la Ville de Paris;boulevard Diderot;75012;Paris;https://padlet.com/clubseniorscasvp/restonsconnectes;;Blog Restons connectés;Jeux;Tous publics;VIDÉO|FLUX EN DIRECT|PROGRAMMES EN DIFFÉRÉ|COURS EN LIGNE|COURS EN LIGNE OUVERTS ET MASSIFS|CONFÉRENCES|TUTORIELS|JEUX;PEINTURE|PHOTOGRAPHIE;FACILE À LIRE ET À COMPRENDRE (FALC);Le temps de manger un sandwich pendant une pause déjeuner;Accès permanent;Collectivité territoriale;;;48.846747,2.381364;48.846747;2.381364;75012;10;"Les personnes âgées sont aujourd’hui parmi les populations les plus vulnérables face à la pandémie de Covid-19. Elles doivent être tout particulièrement protégées. Mais «&nbsp;protéger&nbsp;» ne doit pas rimer avec «&nbsp;isoler&nbsp;». Dans ce contexte particulier,&nbsp;&nbsp;nous avons mis en ligne un blog destiné à les accompagner avec des propositions d’ateliers en visioconférence, des réponses rapides aux questions par mail et des propositions d’activités diverses et variées.";false;false;true;2023-10-11
1600;Recording;Avenue de la République;83000;Toulon;https://recordingtv.fr;;Musique électronique;Concerts, spectacles;Tous publics;VIDÉO|FLUX EN DIRECT|PROGRAMMES EN DIFFÉRÉ;ARCHITECTURE ET PATRIMOINE|ARTS NUMÉRIQUES|ARTS VISUELS|AUDIOVISUEL|MONUMENTS HISTORIQUES|MUSIQUE|CONCERTS ET OPÉRAS;;Le temps d’une soirée;Accès permanent;Collectivité territoriale;;;43.120035,5.932593;43.120035;5.932593;83000;120;L'association Recording organise et diffuse des concerts et performances artistiques depuis des lieux uniques. Une expérience singulière qui vous transportera sur des sites emblématiques, accompagné d'une programmation musicale étudiée et soignée.;false;false;false;2022-08-14
1646;Réunion des Musées Métropolitains Rouen Normandie;26 bis rue Jean Lecanuet;76000;Rouen;https://my.matterport.com/show/?m=z2JFJ536jhj;;Exposition virtuelle - Nymphéas Noirs;Expos, musées;Tous publics;EXPOSITIONS VIRTUELLES;ARTS VISUELS|BANDE DESSINÉE|MUSÉES;;Le temps de manger un sandwich pendant une pause déjeuner;Accès permanent;Collectivité territoriale;;Navigation avec la souris;49.444119,1.095516;49.444119;1.095516;76000;10;Cette année, Michel Bussi, Didier Cassegrain et Fred Duval prennent leurs quartiers d’été au musée à l’occasion du festival Normandie Impressionniste et en partenariat avec Normandiebulle, festival de Bande Dessinée de Darnétal. Sur les cimaises du musée, découvrez les planches originales de Nymphéas noirs, l’adaptation en bande dessinée par Didier Cassegrain et Fred Duval du célèbre roman éponyme de Michel Bussi. Une exposition virtuelle a découvrir sans plus attendre.;false;false;false;2024-07-05
1682;Musée d'Art Contemporain [mac];69 Avenue d'Haifa;13008;Marseille;https://www.navigart.fr/macmarseille/artworks;;Collections en ligne;Expos, musées;Tous publics;IMAGES|COLLECTIONS NUMÉRISÉES|BASES DE DONNÉES;ARTS DÉCORATIFS|DESIGN|MÉTIERS D’ART|ARTS VISUELS|MUSÉES;;Le temps d’un vrai déjeuner;Accès permanent;Collectivité territoriale;;;43.250498,5.389412;43.250498;5.389412;13008;60;Le musée d'art contemporain de Marseille, également appelé « MAC », est le musée de la ville consacré à l'art contemporain avec des collections d'œuvres des années 1960 à nos jours.;false;false;false;2024-12-01
